{
  "$schema": "https://json-schema.org/draft/2020-12/schema",
  "title": "compounds.json - A1 output after finalise.py",
  "type": "array",
  "items": {
    "type": [
      "object",
      "null"
    ],
    "properties": {
      "id": {
        "type": [
          "string",
          "null"
        ]
      },
      "patent_id": {
        "type": "string"
      },
      "identifier": {
        "type": "string"
      },
      "identifier_type": {
        "type": [
          "string",
          "null"
        ],
        "enum": [
          "iupac",
          "smiles",
          "local_label",
          "functional_ref",
          "abbreviation",
          "formula",
          "trivial_name",
          "other",
          null
        ]
      },
      "aliases": {
        "type": [
          "array",
          "null"
        ],
        "items": {
          "type": "string"
        }
      },
      "resolved": {
        "type": [
          "boolean",
          "null"
        ]
      },
      "unresolved_reference": {
        "type": [
          "boolean",
          "null"
        ]
      },
      "section_label": {
        "type": [
          "string",
          "null"
        ]
      },
      "section_type": {
        "type": [
          "string",
          "null"
        ],
        "enum": [
          "bibliographic",
          "abstract",
          "technical_field",
          "background",
          "summary_of_invention",
          "beneficial_effects",
          "formula_definitions",
          "description_of_drawings",
          "experimental_intermediate",
          "experimental_example",
          "comparative_example",
          "assay_data",
          "pharmaceutical_compositions",
          "claims",
          "search_report",
          "other",
          null
        ]
      },
      "is_section_product": {
        "type": [
          "boolean",
          "null"
        ]
      },
      "commercially_available": {
        "type": [
          "boolean",
          "null"
        ]
      },
      "role": {
        "type": [
          "string",
          "null"
        ],
        "enum": [
          "product",
          "reactant",
          "reagent",
          "solvent",
          "catalyst",
          "ligand",
          "base",
          "acid",
          "oxidant",
          "reductant",
          "by_product",
          "additive",
          "drying_agent",
          "other",
          null
        ]
      },
      "quantity": {
        "type": [
          "object",
          "null"
        ],
        "properties": {
          "mass_g": {
            "type": [
              "number",
              "null"
            ]
          },
          "volume_ml": {
            "type": [
              "number",
              "null"
            ]
          },
          "mmol": {
            "type": [
              "number",
              "null"
            ]
          },
          "equivalents": {
            "type": [
              "number",
              "null"
            ]
          },
          "yield_pct": {
            "type": [
              "number",
              "null"
            ]
          }
        },
        "required": [],
        "additionalProperties": false
      },
      "ms_mz": {
        "type": [
          "number",
          "null"
        ]
      },
      "nmr": {
        "type": [
          "object",
          "null"
        ],
        "properties": {
          "h1": {
            "type": [
              "string",
              "null"
            ]
          },
          "c13": {
            "type": [
              "string",
              "null"
            ]
          },
          "raw_text": {
            "type": [
              "string",
              "null"
            ]
          },
          "solvent": {
            "type": [
              "string",
              "null"
            ]
          },
          "frequency_mhz": {
            "type": [
              "number",
              "null"
            ]
          }
        },
        "required": [],
        "additionalProperties": false
      },
      "melting_point": {
        "type": [
          "object",
          "null"
        ],
        "properties": {
          "min_c": {
            "type": [
              "number",
              "null"
            ]
          },
          "max_c": {
            "type": [
              "number",
              "null"
            ]
          },
          "range_text": {
            "type": [
              "string",
              "null"
            ]
          },
          "decomposition": {
            "type": [
              "boolean",
              "null"
            ]
          }
        },
        "required": [],
        "additionalProperties": false
      },
      "appearance": {
        "type": [
          "string",
          "null"
        ]
      },
      "color": {
        "type": [
          "string",
          "null"
        ]
      },
      "physical_form": {
        "type": [
          "string",
          "null"
        ],
        "enum": [
          "solid",
          "liquid",
          "gas",
          "gel",
          "resin",
          "oil",
          "powder",
          "crystals",
          "other",
          null
        ]
      },
      "analytics": {
        "type": [
          "array",
          "null"
        ],
        "items": {
          "type": [
            "object",
            "null"
          ],
          "properties": {
            "method": {
              "type": [
                "string",
                "null"
              ],
              "enum": [
                "hplc",
                "gc",
                "ms",
                "nmr",
                "ir",
                "uv",
                "tlc",
                "elemental",
                "xrd",
                "dsc",
                "tga",
                "boiling_point",
                "optical_rotation",
                "other",
                null
              ]
            },
            "value": {
              "type": [
                "number",
                "null"
              ]
            },
            "unit": {
              "type": [
                "string",
                "null"
              ]
            },
            "conditions": {
              "type": [
                "string",
                "null"
              ]
            },
            "raw_text": {
              "type": "string"
            }
          },
          "required": [
            "method",
            "raw_text"
          ],
          "additionalProperties": false
        }
      },
      "purity_pct": {
        "type": [
          "number",
          "null"
        ]
      },
      "purity_method": {
        "type": [
          "string",
          "null"
        ],
        "enum": [
          "hplc",
          "gc",
          "nmr",
          "uv",
          "titration",
          "other",
          null
        ]
      },
      "compound_uuid": {
        "type": [
          "string",
          "null"
        ]
      },
      "tags": {
        "type": [
          "array",
          "null"
        ],
        "items": {
          "type": "string",
          "pattern": "^[a-z_]+:[a-z0-9_/.+-]+$"
        }
      },
      "notes": {
        "type": [
          "string",
          "null"
        ]
      },
      "smiles": {
        "type": "null"
      },
      "smiles_source": {
        "type": "null"
      },
      "inchi_key": {
        "type": "null"
      },
      "molecular_formula": {
        "type": "null"
      },
      "molecular_weight": {
        "type": "null"
      }
    },
    "required": [
      "patent_id",
      "identifier",
      "identifier_type",
      "role",
      "section_label"
    ],
    "additionalProperties": false
  }
}