[
  {
    "patent_id": "CN106008290A",
    "identifier": "tembotrione",
    "identifier_type": "trivial_name",
    "aliases": [
      "环磺酮"
    ],
    "smiles": null,
    "resolved": true,
    "unresolved_reference": false,
    "section_label": "Beneficial Effects",
    "section_type": "beneficial_effects",
    "is_section_product": true,
    "commercially_available": false,
    "role": "product",
    "quantity": {
      "mass_g": null,
      "volume_ml": null,
      "mmol": null,
      "equivalents": null,
      "yield_pct": null
    },
    "ms_mz": null,
    "nmr": null,
    "melting_point": null,
    "appearance": null,
    "color": null,
    "physical_form": null,
    "analytics": null,
    "purity_pct": null,
    "purity_method": null,
    "tags": [
      "compound_class:active_ingredient",
      "chemical_family:cyclohexanedione",
      "functional_group:ketone",
      "functional_group:sulfone",
      "functional_group:ether",
      "functional_group:halide_chloro",
      "functional_group:trifluoromethyl"
    ],
    "notes": "环磺酮 resolved to tembotrione, the 1,3-cyclohexanedione acylated by 2-chloro-4-(methylsulfonyl)-3-[(2,2,2-trifluoroethoxy)methyl]benzoic acid, consistent with the trifluoroethoxymethyl benzoic acid named as the key intermediate in this same sentence. It is not sulcotrione (磺草酮), which lacks that group. The section states the invention provides a process for preparing it; no isolated batch is described here."
  },
  {
    "patent_id": "CN106008290A",
    "identifier": "sodium 2,2,2-trifluoroethoxide",
    "identifier_type": "iupac",
    "aliases": [
      "三氟乙醇钠"
    ],
    "smiles": null,
    "resolved": true,
    "unresolved_reference": false,
    "section_label": "Beneficial Effects",
    "section_type": "beneficial_effects",
    "is_section_product": false,
    "commercially_available": false,
    "role": "reactant",
    "quantity": {
      "mass_g": null,
      "volume_ml": null,
      "mmol": null,
      "equivalents": null,
      "yield_pct": null
    },
    "ms_mz": null,
    "nmr": null,
    "melting_point": null,
    "appearance": null,
    "color": null,
    "physical_form": null,
    "analytics": null,
    "purity_pct": null,
    "purity_method": null,
    "tags": [
      "compound_class:starting_material",
      "functional_group:trifluoromethyl"
    ],
    "notes": "Named by the Chinese as 反应物 (the reactant) of the invention's method. The Chinese writes 三氟乙醇钠 without locants; the 2,2,2- pattern follows from the trifluoroethyl group, which the EN line also renders as sodium trifluoroethoxide. commercially_available left false: this section does not say it is purchased and does not say whether a step of the patent prepares it."
  },
  {
    "patent_id": "CN106008290A",
    "identifier": "2,2,2-trifluoroethanol",
    "identifier_type": "iupac",
    "aliases": [
      "三氟乙醇",
      "trifluoroethanol"
    ],
    "smiles": null,
    "resolved": true,
    "unresolved_reference": false,
    "section_label": "Beneficial Effects",
    "section_type": "beneficial_effects",
    "is_section_product": false,
    "commercially_available": true,
    "role": "reactant",
    "quantity": {
      "mass_g": null,
      "volume_ml": null,
      "mmol": null,
      "equivalents": null,
      "yield_pct": null
    },
    "ms_mz": null,
    "nmr": null,
    "melting_point": null,
    "appearance": null,
    "color": null,
    "physical_form": null,
    "analytics": null,
    "purity_pct": null,
    "purity_method": null,
    "tags": [
      "compound_class:starting_material",
      "functional_group:trifluoromethyl"
    ],
    "notes": "Named only as part of the prior-art route the invention says it improves on, not as a reagent of the invention's own method. Bulk commodity solvent/reagent that no step of this section prepares."
  },
  {
    "patent_id": "CN106008290A",
    "identifier": "potassium tert-butoxide",
    "identifier_type": "iupac",
    "aliases": [
      "叔丁醇钾"
    ],
    "smiles": null,
    "resolved": true,
    "unresolved_reference": false,
    "section_label": "Beneficial Effects",
    "section_type": "beneficial_effects",
    "is_section_product": false,
    "commercially_available": true,
    "role": "base",
    "quantity": {
      "mass_g": null,
      "volume_ml": null,
      "mmol": null,
      "equivalents": null,
      "yield_pct": null
    },
    "ms_mz": null,
    "nmr": null,
    "melting_point": null,
    "appearance": null,
    "color": null,
    "physical_form": null,
    "analytics": null,
    "purity_pct": null,
    "purity_method": null,
    "tags": [
      "compound_class:base"
    ],
    "notes": "Named only in the prior-art comparison, paired with 三氟乙醇 as the low-yield, high-cost way of making the key intermediate. Bulk commodity base."
  },
  {
    "patent_id": "CN106008290A",
    "identifier": "2-chloro-3-(trifluoroethoxymethyl)-4-(methylsulfonyl)benzoic acid",
    "identifier_type": "iupac",
    "aliases": [
      "2-氯-3-三氟乙氧甲基-4-甲磺基苯甲酸"
    ],
    "smiles": null,
    "resolved": true,
    "unresolved_reference": false,
    "section_label": "Beneficial Effects",
    "section_type": "beneficial_effects",
    "is_section_product": false,
    "commercially_available": false,
    "role": "product",
    "quantity": {
      "mass_g": null,
      "volume_ml": null,
      "mmol": null,
      "equivalents": null,
      "yield_pct": null
    },
    "ms_mz": null,
    "nmr": null,
    "melting_point": null,
    "appearance": null,
    "color": null,
    "physical_form": null,
    "analytics": null,
    "purity_pct": null,
    "purity_method": null,
    "tags": [
      "compound_class:intermediate",
      "chemical_family:benzoic_acid",
      "functional_group:carboxylic_acid",
      "functional_group:sulfone",
      "functional_group:ether",
      "functional_group:halide_chloro",
      "functional_group:trifluoromethyl"
    ],
    "notes": "The Chinese calls it 关键中间体 (key intermediate), so role is product of that preparation step and not the product of this section. Two points where the printed Chinese and the EN line differ, and the Chinese is followed: the Chinese writes 甲磺基 (methylsulfonyl) without 酰, and it writes 三氟乙氧甲基 with no locants, where the EN line supplies 2,2,2-trifluoroethoxymethyl. Both are recorded as printed."
  },
  {
    "patent_id": "CN106008290A",
    "identifier": "acetone cyanohydrin",
    "identifier_type": "trivial_name",
    "aliases": [
      "丙酮氰醇"
    ],
    "smiles": null,
    "resolved": true,
    "unresolved_reference": false,
    "section_label": "Beneficial Effects",
    "section_type": "beneficial_effects",
    "is_section_product": false,
    "commercially_available": true,
    "role": "catalyst",
    "quantity": {
      "mass_g": null,
      "volume_ml": null,
      "mmol": null,
      "equivalents": null,
      "yield_pct": null
    },
    "ms_mz": null,
    "nmr": null,
    "melting_point": null,
    "appearance": null,
    "color": null,
    "physical_form": null,
    "analytics": null,
    "purity_pct": null,
    "purity_method": null,
    "tags": [
      "compound_class:catalyst",
      "functional_group:nitrile",
      "hazard:toxic",
      "hazard:cyanide_handling"
    ],
    "notes": "Printed 丙酮氰醇, acetone cyanohydrin, not the transposed 氰基丙酮 (cyanoacetone). The Chinese calls it a 剧毒催化剂 (highly toxic catalyst) required by the acid-chloride/ester/rearrangement prior-art route, which the invention avoids; role and hazard tags come from that wording."
  }
]
