[
  {
    "patent_id": "CN106008290A",
    "identifier": "sodium trifluoroethoxide",
    "identifier_type": "iupac",
    "aliases": [
      "三氟乙醇钠"
    ],
    "resolved": true,
    "unresolved_reference": false,
    "section_label": "Abstract",
    "section_type": "abstract",
    "is_section_product": false,
    "commercially_available": true,
    "role": "reactant",
    "quantity": {
      "mass_g": null,
      "volume_ml": null,
      "mmol": null,
      "equivalents": null,
      "yield_pct": null
    },
    "ms_mz": null,
    "nmr": null,
    "melting_point": null,
    "appearance": null,
    "color": null,
    "physical_form": null,
    "analytics": [],
    "purity_pct": null,
    "purity_method": null,
    "tags": [
      "compound_class:reagent",
      "functional_group:trifluoromethyl",
      "functional_group:ether"
    ],
    "notes": "Chinese 三氟乙醇钠 prints no locants; resolved as the sodium salt of trifluoroethanol without inferring the 2,2,2- positions. Supplies the trifluoroethoxy group of the product, so recorded as reactant rather than reagent."
  },
  {
    "patent_id": "CN106008290A",
    "identifier": "methyl 2-chloro-3-bromomethyl-4-methanesulfonylbenzoate",
    "identifier_type": "iupac",
    "aliases": [
      "2-氯-3-溴甲基-4-甲磺基苯甲酸甲酯"
    ],
    "resolved": true,
    "unresolved_reference": false,
    "section_label": "Abstract",
    "section_type": "abstract",
    "is_section_product": false,
    "commercially_available": true,
    "role": "reactant",
    "quantity": {
      "mass_g": null,
      "volume_ml": null,
      "mmol": null,
      "equivalents": null,
      "yield_pct": null
    },
    "ms_mz": null,
    "nmr": null,
    "melting_point": null,
    "appearance": null,
    "color": null,
    "physical_form": null,
    "analytics": [],
    "purity_pct": null,
    "purity_method": null,
    "tags": [
      "compound_class:starting_material",
      "chemical_family:benzoic_acid",
      "functional_group:ester",
      "functional_group:sulfone",
      "functional_group:halide_chloro",
      "functional_group:halide_bromo"
    ],
    "notes": "The Chinese prints 甲磺基, i.e. methanesulfonyl written without 酰; resolved as methanesulfonyl (甲磺酰基) and recorded here rather than normalised silently. Named twice in the section, once for the invention and once for the traditional method; one merged record."
  },
  {
    "patent_id": "CN106008290A",
    "identifier": "2-chloro-3-trifluoroethoxymethyl-4-methanesulfonylbenzoic acid",
    "identifier_type": "iupac",
    "aliases": [
      "2-氯-3-三氟乙氧甲基-4-甲磺基苯甲酸"
    ],
    "resolved": true,
    "unresolved_reference": false,
    "section_label": "Abstract",
    "section_type": "abstract",
    "is_section_product": false,
    "commercially_available": false,
    "role": "product",
    "quantity": {
      "mass_g": null,
      "volume_ml": null,
      "mmol": null,
      "equivalents": null,
      "yield_pct": null
    },
    "ms_mz": null,
    "nmr": null,
    "melting_point": null,
    "appearance": null,
    "color": null,
    "physical_form": null,
    "analytics": [],
    "purity_pct": null,
    "purity_method": null,
    "tags": [
      "compound_class:intermediate",
      "chemical_family:benzoic_acid",
      "functional_group:carboxylic_acid",
      "functional_group:sulfone",
      "functional_group:ether",
      "functional_group:trifluoromethyl"
    ],
    "notes": "The Chinese prints 甲磺基 without 酰; resolved as methanesulfonyl and recorded, not normalised silently. Internal inconsistency: the section says the reaction of 三氟乙醇钠 with the methyl ester yields this free acid (生成的...苯甲酸), but names no ester hydrolysis or demethylation; the Chinese is followed as printed. Merged from two mentions, the invention route and the traditional route."
  },
  {
    "patent_id": "CN106008290A",
    "identifier": "1,3-cyclohexanedione",
    "identifier_type": "iupac",
    "aliases": [
      "1，3-环己二酮"
    ],
    "resolved": true,
    "unresolved_reference": false,
    "section_label": "Abstract",
    "section_type": "abstract",
    "is_section_product": false,
    "commercially_available": true,
    "role": "reactant",
    "quantity": {
      "mass_g": null,
      "volume_ml": null,
      "mmol": null,
      "equivalents": null,
      "yield_pct": null
    },
    "ms_mz": null,
    "nmr": null,
    "melting_point": null,
    "appearance": null,
    "color": null,
    "physical_form": null,
    "analytics": [],
    "purity_pct": null,
    "purity_method": null,
    "tags": [
      "compound_class:starting_material",
      "chemical_family:cyclohexanedione",
      "functional_group:ketone"
    ],
    "notes": "Locants are printed by the source (with a fullwidth comma, 1，3-), so the dione is unambiguous and needs no inference."
  },
  {
    "patent_id": "CN106008290A",
    "identifier": "tembotrione",
    "identifier_type": "trivial_name",
    "aliases": [
      "环磺酮"
    ],
    "resolved": true,
    "unresolved_reference": false,
    "section_label": "Abstract",
    "section_type": "abstract",
    "is_section_product": true,
    "commercially_available": false,
    "role": "product",
    "quantity": {
      "mass_g": null,
      "volume_ml": null,
      "mmol": null,
      "equivalents": null,
      "yield_pct": null
    },
    "ms_mz": null,
    "nmr": null,
    "melting_point": null,
    "appearance": null,
    "color": null,
    "physical_form": null,
    "analytics": [],
    "purity_pct": null,
    "purity_method": null,
    "tags": [
      "compound_class:active_ingredient",
      "chemical_family:cyclohexanedione"
    ],
    "notes": "环磺酮 is the Chinese common name of tembotrione, consistent with the condensation of the printed benzoic acid with 1，3-环己二酮. Translation conflict: the EN line renders it descriptively as 'tembotrione-type cyclic sulfone ketone (huanhuangtong)' and elsewhere as 'the cyclic sulfone ketone', which reads as a compound class; the Chinese names one specific compound and is followed."
  },
  {
    "patent_id": "CN106008290A",
    "identifier": "2,2,2-trifluoroethanol",
    "identifier_type": "iupac",
    "aliases": [
      "三氟乙醇",
      "trifluoroethanol"
    ],
    "resolved": true,
    "unresolved_reference": false,
    "section_label": "Abstract",
    "section_type": "abstract",
    "is_section_product": false,
    "commercially_available": true,
    "role": "reactant",
    "quantity": {
      "mass_g": null,
      "volume_ml": null,
      "mmol": null,
      "equivalents": null,
      "yield_pct": null
    },
    "ms_mz": null,
    "nmr": null,
    "melting_point": null,
    "appearance": null,
    "color": null,
    "physical_form": null,
    "analytics": [],
    "purity_pct": null,
    "purity_method": null,
    "tags": [
      "compound_class:reagent",
      "functional_group:trifluoromethyl"
    ],
    "notes": "Named only as part of the traditional method the invention displaces. Chinese prints no locants, so the 2,2,2- positions are not inferred."
  },
  {
    "patent_id": "CN106008290A",
    "identifier": "potassium tert-butoxide",
    "identifier_type": "iupac",
    "aliases": [
      "叔丁醇钾"
    ],
    "resolved": true,
    "unresolved_reference": false,
    "section_label": "Abstract",
    "section_type": "abstract",
    "is_section_product": false,
    "commercially_available": true,
    "role": "base",
    "quantity": {
      "mass_g": null,
      "volume_ml": null,
      "mmol": null,
      "equivalents": null,
      "yield_pct": null
    },
    "ms_mz": null,
    "nmr": null,
    "melting_point": null,
    "appearance": null,
    "color": null,
    "physical_form": null,
    "analytics": [],
    "purity_pct": null,
    "purity_method": null,
    "tags": [
      "compound_class:base"
    ],
    "notes": "Named only in the traditional method, which the section says gives low yield and uses an expensive reagent. No number is printed for either."
  },
  {
    "patent_id": "CN106008290A",
    "identifier": "acetone cyanohydrin",
    "identifier_type": "trivial_name",
    "aliases": [
      "丙酮氰醇"
    ],
    "resolved": true,
    "unresolved_reference": false,
    "section_label": "Abstract",
    "section_type": "abstract",
    "is_section_product": false,
    "commercially_available": true,
    "role": "catalyst",
    "quantity": {
      "mass_g": null,
      "volume_ml": null,
      "mmol": null,
      "equivalents": null,
      "yield_pct": null
    },
    "ms_mz": null,
    "nmr": null,
    "melting_point": null,
    "appearance": null,
    "color": null,
    "physical_form": null,
    "analytics": [],
    "purity_pct": null,
    "purity_method": null,
    "tags": [
      "compound_class:catalyst",
      "functional_group:nitrile",
      "hazard:toxic",
      "hazard:cyanide_handling"
    ],
    "notes": "The section calls it 剧毒催化剂 (highly toxic catalyst), which supports the hazard tags. Printed as 丙酮氰醇 (acetone cyanohydrin), not 氰基丙酮 (cyanoacetone); translated as printed. Belongs to the acid chloride/ester rearrangement route the invention avoids."
  }
]
