[
  {
    "patent_id": "WO2024109718A1",
    "identifier": "式(I)化合物",
    "identifier_type": "local_label",
    "aliases": ["compound of formula (I)", "CSc1ccc(Br)c(Cl)c1C"],
    "resolved": false,
    "unresolved_reference": true,
    "section_label": "Example 3",
    "section_type": "experimental_intermediate",
    "is_section_product": false,
    "commercially_available": false,
    "role": "reactant",
    "quantity": {
      "mass_g": 146.0,
      "volume_ml": null,
      "mmol": null,
      "equivalents": null,
      "yield_pct": null
    },
    "ms_mz": null,
    "nmr": null,
    "melting_point": null,
    "appearance": null,
    "color": null,
    "physical_form": null,
    "analytics": null,
    "purity_pct": null,
    "purity_method": null,
    "tags": [
      "compound_class:intermediate",
      "functional_group:sulfide",
      "functional_group:halide_bromo",
      "functional_group:halide_chloro"
    ],
    "notes": "Bare formula label; this section does not spell out a name for it, so it is kept unresolved. The reaction-scheme span on line 451 draws the reactant of this step as CSc1ccc(Br)c(Cl)c1C (a methylthio arene, consistent with oxidation to the formula (II) sulfone), and that SMILES is carried as an alias."
  },
  {
    "patent_id": "WO2024109718A1",
    "identifier": "sodium tungstate dihydrate",
    "identifier_type": "iupac",
    "aliases": ["二水合钨酸钠"],
    "resolved": true,
    "unresolved_reference": false,
    "section_label": "Example 3",
    "section_type": "experimental_intermediate",
    "is_section_product": false,
    "commercially_available": true,
    "role": "catalyst",
    "quantity": {
      "mass_g": 1.91,
      "volume_ml": null,
      "mmol": null,
      "equivalents": null,
      "yield_pct": null
    },
    "ms_mz": null,
    "nmr": null,
    "melting_point": null,
    "appearance": null,
    "color": null,
    "physical_form": null,
    "analytics": null,
    "purity_pct": null,
    "purity_method": null,
    "tags": ["compound_class:catalyst"],
    "notes": "Sub-stoichiometric relative to the 146 g of formula (I) charge; catalyst for the hydrogen peroxide oxidation."
  },
  {
    "patent_id": "WO2024109718A1",
    "identifier": "glacial acetic acid",
    "identifier_type": "trivial_name",
    "aliases": ["冰醋酸"],
    "resolved": true,
    "unresolved_reference": false,
    "section_label": "Example 3",
    "section_type": "experimental_intermediate",
    "is_section_product": false,
    "commercially_available": true,
    "role": "solvent",
    "quantity": {
      "mass_g": null,
      "volume_ml": 600.0,
      "mmol": null,
      "equivalents": null,
      "yield_pct": null
    },
    "ms_mz": null,
    "nmr": null,
    "melting_point": null,
    "appearance": null,
    "color": null,
    "physical_form": null,
    "analytics": null,
    "purity_pct": null,
    "purity_method": null,
    "tags": [
      "compound_class:solvent",
      "functional_group:carboxylic_acid"
    ],
    "notes": null
  },
  {
    "patent_id": "WO2024109718A1",
    "identifier": "hydrogen peroxide",
    "identifier_type": "iupac",
    "aliases": ["双氧水", "H2O2"],
    "resolved": true,
    "unresolved_reference": false,
    "section_label": "Example 3",
    "section_type": "experimental_intermediate",
    "is_section_product": false,
    "commercially_available": true,
    "role": "oxidant",
    "quantity": {
      "mass_g": 224.0,
      "volume_ml": null,
      "mmol": null,
      "equivalents": null,
      "yield_pct": null
    },
    "ms_mz": null,
    "nmr": null,
    "melting_point": null,
    "appearance": null,
    "color": null,
    "physical_form": null,
    "analytics": null,
    "purity_pct": null,
    "purity_method": null,
    "tags": ["compound_class:reagent"],
    "notes": "Charged as 224 g of 23％ hydrogen peroxide, added dropwise at 80℃; the 224 g is the mass of the aqueous solution as printed, not of contained H2O2, and no contained mass is stated. Merged with the H2O2 named in the conditions of the reaction-scheme span on line 451. The patent charges this as a 23% aqueous solution; the strength is recorded here and in the quantity note rather than as an alias, because a solution of a substance is not another name for it."
  },
  {
    "patent_id": "WO2024109718A1",
    "identifier": "water",
    "identifier_type": "iupac",
    "aliases": ["水"],
    "resolved": true,
    "unresolved_reference": false,
    "section_label": "Example 3",
    "section_type": "experimental_intermediate",
    "is_section_product": false,
    "commercially_available": true,
    "role": "solvent",
    "quantity": {
      "mass_g": null,
      "volume_ml": null,
      "mmol": null,
      "equivalents": null,
      "yield_pct": null
    },
    "ms_mz": null,
    "nmr": null,
    "melting_point": null,
    "appearance": null,
    "color": null,
    "physical_form": null,
    "analytics": null,
    "purity_pct": null,
    "purity_method": null,
    "tags": ["compound_class:workup_agent"],
    "notes": "Used to wash the filter cake twice; no quantity is given."
  },
  {
    "patent_id": "WO2024109718A1",
    "identifier": "式(II)化合物",
    "identifier_type": "local_label",
    "aliases": ["compound of formula (II)", "Cc1c(S(C)(=O)=O)ccc(Br)c1Cl"],
    "resolved": false,
    "unresolved_reference": true,
    "section_label": "Example 3",
    "section_type": "experimental_intermediate",
    "is_section_product": true,
    "commercially_available": false,
    "role": "product",
    "quantity": {
      "mass_g": null,
      "volume_ml": null,
      "mmol": null,
      "equivalents": null,
      "yield_pct": null
    },
    "ms_mz": null,
    "nmr": null,
    "melting_point": {
      "min_c": 138.0,
      "max_c": 140.0,
      "range_text": "熔点138-140℃",
      "decomposition": null
    },
    "appearance": null,
    "color": null,
    "physical_form": null,
    "analytics": [
      {
        "method": "hplc",
        "value": null,
        "unit": null,
        "conditions": "高效液相色谱条件：与实施例1相同。",
        "raw_text": "通过高效液相色谱监测反应完成后"
      },
      {
        "method": "nmr",
        "value": null,
        "unit": null,
        "conditions": "CDCl3",
        "raw_text": "式(II)化合物的1HNMR(CDCl3)谱图如图5所示，13CNMR(CDCl3)谱图如图6所示。"
      }
    ],
    "purity_pct": null,
    "purity_method": null,
    "tags": [
      "compound_class:intermediate",
      "chemical_family:aryl_sulfone",
      "functional_group:sulfone",
      "functional_group:halide_bromo",
      "functional_group:halide_chloro"
    ],
    "notes": "Section product. Bare formula label, kept unresolved; the scheme on line 451 draws the product as Cc1c(S(C)(=O)=O)ccc(Br)c1Cl and that SMILES is carried as an alias. No isolated mass and no yield are printed for this step. 1H and 13C NMR are referred to only as Figures 5 and 6, so no spectral text exists to transcribe; the reference is recorded under analytics and nmr is left null."
  }
]
