[
  {
    "patent_id": "US20040236146A1",
    "identifier": "3-bromomethylbenzoic acids of the formula II",
    "identifier_type": "other",
    "aliases": [],
    "resolved": false,
    "unresolved_reference": true,
    "section_label": "Abstract",
    "section_type": "abstract",
    "is_section_product": true,
    "commercially_available": false,
    "role": "product",
    "quantity": null,
    "ms_mz": null,
    "nmr": null,
    "melting_point": null,
    "appearance": null,
    "color": null,
    "physical_form": null,
    "analytics": [],
    "purity_pct": null,
    "purity_method": null,
    "tags": ["compound_class:other", "chemical_family:benzoic_acid", "functional_group:carboxylic_acid", "functional_group:halide_bromo"],
    "notes": "Markush genus, the product of the one transformation the abstract states. resolved is false because a plural genus with an open R1 and R2 names no single compound, and unresolved_reference is true because the name points at the drawn formula II for the substituents it does not itself give. That drawing is the IMAGE_EXTRACT span at line 42 and it carries no molecules, the vision pass having correctly refused a SMILES for a generic, so the structure is drawn but no structure reached this record. identifier_type is other because none of the listed types fits a genus: it is not the IUPAC name of one compound, not a bare local label, and formula in this vocabulary means a molecular formula. is_section_product is true because the abstract's transformation ends here. compound_class is other because the abstract alone gives these compounds no downstream use. No record is emitted for the R1 or R2 substituent values per A1 rule 8."
  },
  {
    "patent_id": "US20040236146A1",
    "identifier": "3-methylbenzoic acids",
    "identifier_type": "other",
    "aliases": [],
    "resolved": false,
    "unresolved_reference": false,
    "section_label": "Abstract",
    "section_type": "abstract",
    "is_section_product": false,
    "commercially_available": false,
    "role": "reactant",
    "quantity": null,
    "ms_mz": null,
    "nmr": null,
    "melting_point": null,
    "appearance": null,
    "color": null,
    "physical_form": null,
    "analytics": [],
    "purity_pct": null,
    "purity_method": null,
    "tags": ["compound_class:starting_material", "chemical_family:benzoic_acid", "functional_group:carboxylic_acid"],
    "notes": "Markush genus, the substrate that is brominated. Printed as the corresponding 3-methylbenzoic acids; the word corresponding is the pointer back to formula II and is not part of the name, so the identifier is the class name alone. resolved is false because a plural class names no single compound, but unresolved_reference is false because the name is self-contained rather than a reference to a label. commercially_available is false: the abstract does not say these are purchased and a genus is not a bulk commodity. No structure is drawn for this genus anywhere in the abstract."
  },
  {
    "patent_id": "US20040236146A1",
    "identifier": "compounds of the formula II",
    "identifier_type": "other",
    "aliases": [],
    "resolved": false,
    "unresolved_reference": true,
    "section_label": "Abstract",
    "section_type": "abstract",
    "is_section_product": false,
    "commercially_available": false,
    "role": "other",
    "quantity": null,
    "ms_mz": null,
    "nmr": null,
    "melting_point": null,
    "appearance": null,
    "color": null,
    "physical_form": null,
    "analytics": [],
    "purity_pct": null,
    "purity_method": null,
    "tags": ["compound_class:other", "chemical_family:benzoic_acid", "functional_group:carboxylic_acid", "functional_group:halide_bromo"],
    "notes": "The compound-per-se half of the abstract, kept as its own record rather than merged into the process product because the text names it differently and gives it no step role. It is the same formula II genus as the first record of this section; the family and functional_group tags are carried from the first sentence's naming of formula II as 3-bromomethylbenzoic acids, and no sulfone tag is emitted because the abstract text never says sulfonyl and the drawing at line 42 is a generic that yielded no molecules. role is other because the sentence describes these compounds rather than using them. AS-PRINTED DEFECT: line 46 prints where R1 is fluorine chlorine or bromine with no comma after fluorine, and the EN line at 47 silently supplies it; the as-printed line is the document, the difference is a finding about the patent, and nothing is corrected. Per A1 rule 8 no record is emitted for fluorine, chlorine, bromine or (C1-C4)alkyl, which are R-group definitions and not compounds."
  }
]
